{
  "$schema": "https://vomaste.cz/schemas/canonical/update.schema.json",
  "schemaVersion": 1,
  "@context": "https://vomaste.cz/context/v1.jsonld",
  "@id": "https://vomaste.cz/id/dossiers/igor-cerveny/updates/2026-07-30-2",
  "@type": "vomaste:Update",
  "recordType": "update",
  "identifier": "2026-07-30-2",
  "dossier": {
    "@id": "https://vomaste.cz/id/dossiers/igor-cerveny"
  },
  "date": "2026-07-30",
  "summary": "Zpracována autorizovaná témata: majetkove-priznani, stret-zajmu, kancelare, cesta-usa. 9 zdrojů otevřeno a přečteno, 18 tvrzení, 4 mezery (nedoložitelné položky, paywally). Statusy dle skutečné síly doložení.",
  "addedClaims": [
    {
      "@id": "https://vomaste.cz/id/dossiers/igor-cerveny/claims/CLM-02"
    },
    {
      "@id": "https://vomaste.cz/id/dossiers/igor-cerveny/claims/CLM-03"
    },
    {
      "@id": "https://vomaste.cz/id/dossiers/igor-cerveny/claims/CLM-04"
    },
    {
      "@id": "https://vomaste.cz/id/dossiers/igor-cerveny/claims/CLM-05"
    },
    {
      "@id": "https://vomaste.cz/id/dossiers/igor-cerveny/claims/CLM-06"
    },
    {
      "@id": "https://vomaste.cz/id/dossiers/igor-cerveny/claims/CLM-07"
    },
    {
      "@id": "https://vomaste.cz/id/dossiers/igor-cerveny/claims/CLM-08"
    },
    {
      "@id": "https://vomaste.cz/id/dossiers/igor-cerveny/claims/CLM-09"
    },
    {
      "@id": "https://vomaste.cz/id/dossiers/igor-cerveny/claims/CLM-10"
    },
    {
      "@id": "https://vomaste.cz/id/dossiers/igor-cerveny/claims/CLM-11"
    },
    {
      "@id": "https://vomaste.cz/id/dossiers/igor-cerveny/claims/CLM-12"
    },
    {
      "@id": "https://vomaste.cz/id/dossiers/igor-cerveny/claims/CLM-13"
    },
    {
      "@id": "https://vomaste.cz/id/dossiers/igor-cerveny/claims/CLM-14"
    },
    {
      "@id": "https://vomaste.cz/id/dossiers/igor-cerveny/claims/CLM-15"
    },
    {
      "@id": "https://vomaste.cz/id/dossiers/igor-cerveny/claims/CLM-16"
    },
    {
      "@id": "https://vomaste.cz/id/dossiers/igor-cerveny/claims/CLM-17"
    },
    {
      "@id": "https://vomaste.cz/id/dossiers/igor-cerveny/claims/CLM-18"
    },
    {
      "@id": "https://vomaste.cz/id/dossiers/igor-cerveny/claims/CLM-19"
    }
  ],
  "updatedClaims": [],
  "addedGaps": [
    {
      "@id": "https://vomaste.cz/id/dossiers/igor-cerveny/gaps/GAP-01"
    },
    {
      "@id": "https://vomaste.cz/id/dossiers/igor-cerveny/gaps/GAP-02"
    },
    {
      "@id": "https://vomaste.cz/id/dossiers/igor-cerveny/gaps/GAP-03"
    },
    {
      "@id": "https://vomaste.cz/id/dossiers/igor-cerveny/gaps/GAP-04"
    }
  ],
  "closedGaps": [],
  "reviewedSources": [
    {
      "@id": "https://vomaste.cz/id/dossiers/igor-cerveny/sources/SRC-02"
    },
    {
      "@id": "https://vomaste.cz/id/dossiers/igor-cerveny/sources/SRC-03"
    },
    {
      "@id": "https://vomaste.cz/id/dossiers/igor-cerveny/sources/SRC-04"
    },
    {
      "@id": "https://vomaste.cz/id/dossiers/igor-cerveny/sources/SRC-05"
    },
    {
      "@id": "https://vomaste.cz/id/dossiers/igor-cerveny/sources/SRC-06"
    },
    {
      "@id": "https://vomaste.cz/id/dossiers/igor-cerveny/sources/SRC-07"
    },
    {
      "@id": "https://vomaste.cz/id/dossiers/igor-cerveny/sources/SRC-08"
    },
    {
      "@id": "https://vomaste.cz/id/dossiers/igor-cerveny/sources/SRC-09"
    },
    {
      "@id": "https://vomaste.cz/id/dossiers/igor-cerveny/sources/SRC-10"
    }
  ]
}
